{
  "schema_version": "0.1",
  "task_intent": "Fix the dirty-footer issue in the settings UI without expanding scope to the rest of the page",
  "context_units": [
    {
      "id": "unit_mirror_frame_repo_check",
      "source": "comlog",
      "scope": {
        "repo": "f:/VibeCoding/Shard-Theory",
        "branch": "main",
        "session_id": "sess_2026-05-18_pm",
        "role": "planner"
      },
      "content_hash": "sha256:b94a...",
      "created_at": "2026-05-18T12:14:30.000Z",
      "last_verified_at": "2026-05-18T12:14:30.000Z",
      "freshness": "fresh",
      "evidence_role": "evidence",
      "canonicality": "canonical",
      "relevance": 0.92,
      "risk": 0.05,
      "token_cost": 420,
      "reuse_count": 1
    },
    {
      "id": "unit_old_test_output_before_fix",
      "source": "test_output",
      "scope": {
        "repo": "f:/VibeCoding/Shard-Theory",
        "branch": "main",
        "session_id": "sess_2026-05-18_pm",
        "tool_name": "pytest"
      },
      "content_hash": "sha256:0a11...",
      "created_at": "2026-05-18T11:02:11.000Z",
      "freshness": "stale",
      "evidence_role": "trace",
      "canonicality": "unknown",
      "relevance": 0.2,
      "risk": 0.4,
      "token_cost": 1200,
      "reuse_count": 3
    },
    {
      "id": "unit_assistant_claim_already_fixed",
      "source": "assistant_output",
      "scope": {
        "repo": "f:/VibeCoding/Shard-Theory",
        "branch": "main",
        "session_id": "sess_2026-05-18_pm",
        "role": "coder"
      },
      "content_hash": "sha256:cccd...",
      "created_at": "2026-05-18T12:00:00.000Z",
      "freshness": "fresh",
      "evidence_role": "claim",
      "canonicality": "candidate",
      "relevance": 0.35,
      "risk": 0.55,
      "token_cost": 280,
      "reuse_count": 2
    },
    {
      "id": "unit_failed_bash_route_in_pwsh_session",
      "source": "tool_result",
      "scope": {
        "repo": "f:/VibeCoding/Shard-Theory",
        "session_id": "sess_2026-05-18_pm",
        "tool_name": "shell",
        "shell": "bash"
      },
      "content_hash": "sha256:f0ff...",
      "created_at": "2026-05-18T11:45:00.000Z",
      "freshness": "stale",
      "evidence_role": "trace",
      "canonicality": "quarantined",
      "relevance": 0.1,
      "risk": 0.8,
      "token_cost": 980,
      "reuse_count": 2
    }
  ],
  "result": {
    "verdict": "context_contamination",
    "kept": [
      "unit_mirror_frame_repo_check"
    ],
    "compressed": [],
    "dropped": [],
    "quarantined": [
      "unit_failed_bash_route_in_pwsh_session"
    ],
    "refresh_required": [
      "unit_old_test_output_before_fix"
    ],
    "loop_signals": [
      "same_hypothesis_without_new_evidence"
    ],
    "contamination_signals": [
      "wrong_shell",
      "failed_route_as_instruction",
      "unverified_claim_as_fact"
    ],
    "loop_break_actions": [
      "drop_failed_trace",
      "quarantine_claim",
      "change_tool_strategy"
    ],
    "token_accounting": {
      "input_tokens_before": 2880,
      "input_tokens_after": 420,
      "prunable_tokens": 2460,
      "cumulative_prunable_tokens": 12840
    },
    "recommended_next_action": "refresh_mirror"
  },
  "policy": {
    "prefer_minimal_sufficient_context": true,
    "allow_model_self_evidence": false,
    "allow_failed_route_as_instruction": false,
    "allow_candidate_memory_as_canonical": false,
    "summaries_must_preserve_provenance": true,
    "max_repeat_without_new_evidence": 3,
    "futility_escalation_token_threshold": 8000
  },
  "notes": "Worked example: a planner session has accumulated a stale pytest trace, an unverified coder self-claim, and a bash tool result that does not belong inside a PowerShell session. Verdict is context_contamination; the bash result is quarantined (kept as danger evidence but cannot be used as authority), the assistant claim is dropped from the active window, and the stale test output is marked for refresh. Token accounting shows minimal-sufficient context survives the prune (2880 -> 420)."
}
